<?xml version="1.0" encoding="utf-8"?>
<nlg:NLGSpec xmlns="http://code.google.com/p/simplenlg/schemas/version1"
	xmlns:nlg="http://code.google.com/p/simplenlg/schemas/version1"
	xmlns:xsi="http://www.w3.org/2001/XMLSchema-instance"
	xsi:schemaLocation="http://code.google.com/p/simplenlg/schemas/version1 RealizerSchema.xsd ">

	<nlg:Recording name="Clause tests">

		<nlg:Record name="Negation on VP">
			<Document cat="PARAGRAPH">
				<child xsi:type="SPhraseSpec">
					<subj xsi:type="NPPhraseSpec">
						<head cat="NOUN">
							<base>patient</base>
						</head>
						<spec xsi:type="WordElement" cat="DETERMINER">
							<base>the</base>
						</spec>
					</subj>
					<vp xsi:type="VPPhraseSpec" TENSE="PAST" NEGATED="true">
						<head cat="VERB" var="IRREGULAR">
							<base>lie</base>
						</head>
						<postMod xsi:type="VPPhraseSpec" TENSE="PAST">
							<head cat="VERB">
								<base>etherise</base>
							</head>
							<postMod xsi:type="PPPhraseSpec">
								<head cat="PREPOSITION">
									<base>upon</base>
								</head>
								<compl xsi:type="NPPhraseSpec">
									<head cat="NOUN">
										<base>table</base>
									</head>
									<spec xsi:type="WordElement" cat="DETERMINER">
										<base>a</base>
									</spec>
								</compl>
							</postMod>
						</postMod>
					</vp>
				</child>
			</Document>
		</nlg:Record>

		<nlg:Record name="Negation on S">
			<Document cat="PARAGRAPH">
				<child xsi:type="SPhraseSpec" TENSE="PAST" NEGATED="true">
					<subj xsi:type="NPPhraseSpec">
						<head cat="NOUN">
							<base>patient</base>
						</head>
						<spec xsi:type="WordElement" cat="DETERMINER">
							<base>the</base>
						</spec>
					</subj>
					<vp xsi:type="VPPhraseSpec">
						<head cat="VERB">
							<base>lie</base>
						</head>
						<postMod xsi:type="VPPhraseSpec" TENSE="PAST">
							<head cat="VERB">
								<base>etherise</base>
							</head>
							<postMod xsi:type="PPPhraseSpec">
								<head cat="PREPOSITION">
									<base>upon</base>
								</head>
								<compl xsi:type="NPPhraseSpec">
									<head cat="NOUN">
										<base>table</base>
									</head>
									<spec xsi:type="WordElement" cat="DETERMINER">
										<base>a</base>
									</spec>
								</compl>
							</postMod>
						</postMod>
					</vp>
				</child>
			</Document>
		</nlg:Record>

	</nlg:Recording>
</nlg:NLGSpec>