<?xml version="1.0" encoding="utf-8"?>
<NLGSpec xmlns:xsd="http://www.w3.org/2001/XMLSchema" xmlns:xsi="http://www.w3.org/2001/XMLSchema-instance" xsi:schemaLocation="http://simplenlg.googlecode.com/svn/trunk/res/xml D:\svnNLG\Client\NLGWrapper\RealizerSchema.xsd" xmlns="http://simplenlg.googlecode.com/svn/trunk/res/xml">
 <Recording name="">
   <Record name="">
    <Document cat="PARAGRAPH">
      <child xsi:type="SPhraseSpec" PASSIVE="true">
        <vp xsi:type="VPPhraseSpec" TENSE="PAST">
          <compl xsi:type="NPPhraseSpec">
            <postMod xsi:type="NPPhraseSpec" appositive="true">
              <head cat="NOUN">
                <base>D701000000992</base>
              </head>
              <spec xsi:type="WordElement" cat="DETERMINER">
                <base>the</base>
              </spec>
            </postMod>
            <head cat="NOUN">
              <base>angioplasty balloon catheter</base>
            </head>
            <spec xsi:type="WordElement" cat="DETERMINER">
              <base>a</base>
            </spec>
          </compl>
          <head cat="VERB">
            <base>deploy</base>
          </head>
        </vp>
      </child>
    </Document>
   </Record>
  </Recording>
</NLGSpec>

