<?xml version="1.0" encoding="utf-8" ?>
-
<nl:Document xmlns:xsi="http://www.w3.org/2001/XMLSchema-instance"
	xmlns:xs="http://www.w3.org/2001/XMLSchema" cat="LIST"
	xsi:schemaLocation="http://code.google.com/p/simplenlg/schemas/version1 D:\svnNLG\XMLRealiser\RealizerSchema.xsd"
	xmlns:nl="http://code.google.com/p/simplenlg/schemas/version1">
	-
	<nl:child xsi:type="nl:DocumentElement" cat="LIST_ITEM"
		xsi:schemaLocation="http://code.google.com/p/simplenlg/schemas/version1 D:\svnNLG\XMLRealiser\RealizerSchema.xsd">
		-
		<nl:child xsi:type="nl:CoordinatedPhraseElement" conj="but">
			-
			<nl:coord xsi:type="nl:NPPhraseSpec">
				-
				<nl:preMod xsi:type="nl:StringElement">
					<nl:val>18</nl:val>
				</nl:preMod>
				<nl:head cat="NOUN">thing</nl:head>
				<nl:spec cat="DETERMINER">a</nl:spec>
			</nl:coord>
			-
			<nl:coord xsi:type="nl:NPPhraseSpec">
				-
				<nl:preMod xsi:type="nl:StringElement">
					<nl:val>180</nl:val>
				</nl:preMod>
				<nl:head cat="NOUN">thing</nl:head>
				<nl:spec cat="DETERMINER">a</nl:spec>
			</nl:coord>
		</nl:child>
	</nl:child>
	-
	<nl:child xsi:type="nl:DocumentElement" cat="LIST_ITEM"
		xsi:schemaLocation="http://code.google.com/p/simplenlg/schemas/version1 D:\svnNLG\XMLRealiser\RealizerSchema.xsd">
		-
		<nl:child xsi:type="nl:CoordinatedPhraseElement" conj="but">
			-
			<nl:coord xsi:type="nl:NPPhraseSpec">
				-
				<nl:preMod xsi:type="nl:StringElement">
					<nl:val>18x</nl:val>
				</nl:preMod>
				<nl:head cat="NOUN">thing</nl:head>
				<nl:spec cat="DETERMINER">a</nl:spec>
			</nl:coord>
			-
			<nl:coord xsi:type="nl:NPPhraseSpec">
				-
				<nl:preMod xsi:type="nl:StringElement">
					<nl:val>08</nl:val>
				</nl:preMod>
				<nl:head cat="NOUN">thing</nl:head>
				<nl:spec cat="DETERMINER">a</nl:spec>
			</nl:coord>
		</nl:child>
	</nl:child>
	-
	<nl:child xsi:type="nl:DocumentElement" cat="LIST_ITEM"
		xsi:schemaLocation="http://code.google.com/p/simplenlg/schemas/version1 D:\svnNLG\XMLRealiser\RealizerSchema.xsd">
		-
		<nl:child xsi:type="nl:CoordinatedPhraseElement" conj="but">
			-
			<nl:coord xsi:type="nl:NPPhraseSpec">
				-
				<nl:preMod xsi:type="nl:StringElement">
					<nl:val>11g</nl:val>
				</nl:preMod>
				<nl:head cat="NOUN">thing</nl:head>
				<nl:spec cat="DETERMINER">a</nl:spec>
			</nl:coord>
			-
			<nl:coord xsi:type="nl:NPPhraseSpec">
				-
				<nl:preMod xsi:type="nl:StringElement">
					<nl:val>9i</nl:val>
				</nl:preMod>
				<nl:head cat="NOUN">thing</nl:head>
				<nl:spec cat="DETERMINER">a</nl:spec>
			</nl:coord>
		</nl:child>
	</nl:child>
	<nl:child xsi:type="nl:DocumentElement" cat="LIST_ITEM"
		xsi:schemaLocation="http://code.google.com/p/simplenlg/schemas/version1 D:\svnNLG\XMLRealiser\RealizerSchema.xsd">
		<nl:child xsi:type="nl:CoordinatedPhraseElement" conj="but">
			<nl:coord xsi:type="nl:NPPhraseSpec">
				<nl:preMod xsi:type="nl:StringElement">
					<nl:val>8th</nl:val>
				</nl:preMod>
				<nl:head cat="NOUN">thing</nl:head>
				<nl:spec cat="DETERMINER">a</nl:spec>
			</nl:coord>
			<nl:coord xsi:type="nl:NPPhraseSpec">
				<nl:preMod xsi:type="nl:StringElement">
					<nl:val>9th</nl:val>
				</nl:preMod>
				<nl:head cat="NOUN">thing</nl:head>
				<nl:spec cat="DETERMINER">a</nl:spec>
			</nl:coord>
		</nl:child>
	</nl:child>
	<nl:child xsi:type="nl:DocumentElement" cat="LIST_ITEM"
		xsi:schemaLocation="http://code.google.com/p/simplenlg/schemas/version1 D:\svnNLG\XMLRealiser\RealizerSchema.xsd">
		<nl:child xsi:type="nl:CoordinatedPhraseElement" conj="but">
			<nl:coord xsi:type="nl:NPPhraseSpec">
				<nl:preMod xsi:type="nl:StringElement">
					<nl:val>11th</nl:val>
				</nl:preMod>
				<nl:head cat="NOUN">thing</nl:head>
				<nl:spec cat="DETERMINER">a</nl:spec>
			</nl:coord>
			<nl:coord xsi:type="nl:NPPhraseSpec">
				<nl:preMod xsi:type="nl:StringElement">
					<nl:val>1100</nl:val>
				</nl:preMod>
				<nl:head cat="NOUN">thing</nl:head>
				<nl:spec cat="DETERMINER">a</nl:spec>
			</nl:coord>
		</nl:child>
	</nl:child>
	<nl:child xsi:type="nl:DocumentElement" cat="LIST_ITEM"
		xsi:schemaLocation="http://code.google.com/p/simplenlg/schemas/version1 D:\svnNLG\XMLRealiser\RealizerSchema.xsd">
		<nl:child xsi:type="nl:CoordinatedPhraseElement" conj="but">
			<nl:coord xsi:type="nl:NPPhraseSpec">
				<nl:preMod xsi:type="nl:StringElement">
					<nl:val>11.000</nl:val>
				</nl:preMod>
				<nl:head cat="NOUN">thing</nl:head>
				<nl:spec cat="DETERMINER">a</nl:spec>
			</nl:coord>
			<nl:coord xsi:type="nl:NPPhraseSpec">
				<nl:preMod xsi:type="nl:StringElement">
					<nl:val>11000</nl:val>
				</nl:preMod>
				<nl:head cat="NOUN">thing</nl:head>
				<nl:spec cat="DETERMINER">a</nl:spec>
			</nl:coord>
		</nl:child>
	</nl:child>
	<nl:child xsi:type="nl:DocumentElement" cat="LIST_ITEM"
		xsi:schemaLocation="http://code.google.com/p/simplenlg/schemas/version1 D:\svnNLG\XMLRealiser\RealizerSchema.xsd">
		<nl:child xsi:type="nl:CoordinatedPhraseElement" conj="but">
			<nl:coord xsi:type="nl:NPPhraseSpec">
				-
				<nl:preMod xsi:type="nl:StringElement">
					<nl:val>81000</nl:val>
				</nl:preMod>
				<nl:head cat="NOUN">thing</nl:head>
				<nl:spec cat="DETERMINER">a</nl:spec>
			</nl:coord>
			<nl:coord xsi:type="nl:NPPhraseSpec">
				-
				<nl:preMod xsi:type="nl:StringElement">
					<nl:val>180,000</nl:val>
				</nl:preMod>
				<nl:head cat="NOUN">thing</nl:head>
				<nl:spec cat="DETERMINER">a</nl:spec>
			</nl:coord>
		</nl:child>
	</nl:child>
	<nl:child xsi:type="nl:DocumentElement" cat="LIST_ITEM"
		xsi:schemaLocation="http://code.google.com/p/simplenlg/schemas/version1 D:\svnNLG\XMLRealiser\RealizerSchema.xsd">
		<nl:child xsi:type="nl:CoordinatedPhraseElement" conj="but">
			<nl:coord xsi:type="nl:NPPhraseSpec">
				<nl:preMod xsi:type="nl:StringElement">
					<nl:val>81,000</nl:val>
				</nl:preMod>
				<nl:head cat="NOUN">thing</nl:head>
				<nl:spec cat="DETERMINER">a</nl:spec>
			</nl:coord>
			<nl:coord xsi:type="nl:NPPhraseSpec">
				<nl:preMod xsi:type="nl:StringElement">
					<nl:val>01834</nl:val>
				</nl:preMod>
				<nl:head cat="NOUN">thing</nl:head>
				<nl:spec cat="DETERMINER">a</nl:spec>
			</nl:coord>
		</nl:child>
	</nl:child>
	<nl:child xsi:type="nl:DocumentElement" cat="LIST_ITEM"
		xsi:schemaLocation="http://code.google.com/p/simplenlg/schemas/version1 D:\svnNLG\XMLRealiser\RealizerSchema.xsd">
		<nl:child xsi:type="nl:CoordinatedPhraseElement" conj="but">
			<nl:coord xsi:type="nl:NPPhraseSpec">
				<nl:preMod xsi:type="nl:StringElement">
					<nl:val>8%</nl:val>
				</nl:preMod>
				<nl:head cat="NOUN">thing</nl:head>
				<nl:spec cat="DETERMINER">a</nl:spec>
			</nl:coord>
			<nl:coord xsi:type="nl:NPPhraseSpec">
				<nl:preMod xsi:type="nl:StringElement">
					<nl:val>9%</nl:val>
				</nl:preMod>
				<nl:head cat="NOUN">thing</nl:head>
				<nl:spec cat="DETERMINER">a</nl:spec>
			</nl:coord>
		</nl:child>
	</nl:child>
	<nl:child xsi:type="nl:DocumentElement" cat="LIST_ITEM"
		xsi:schemaLocation="http://code.google.com/p/simplenlg/schemas/version1 D:\svnNLG\XMLRealiser\RealizerSchema.xsd">
		<nl:child xsi:type="nl:CoordinatedPhraseElement" conj="but">
			<nl:coord xsi:type="nl:NPPhraseSpec">
				<nl:preMod xsi:type="nl:StringElement">
					<nl:val>8432425</nl:val>
				</nl:preMod>
				<nl:head cat="NOUN">thing</nl:head>
				<nl:spec cat="DETERMINER">a</nl:spec>
			</nl:coord>
			<nl:coord xsi:type="nl:NPPhraseSpec">
				<nl:preMod xsi:type="nl:StringElement">
					<nl:val>42nd</nl:val>
				</nl:preMod>
				<nl:head cat="NOUN">thing</nl:head>
				<nl:spec cat="DETERMINER">a</nl:spec>
			</nl:coord>
		</nl:child>
	</nl:child>
</nl:Document>

